{
  "schema_version": 1,
  "sequence": 1,
  "event_type": "activation",
  "occurred_at": "2026-09-02T12:00:00.000Z",
  "target_id": "rust-borrow",
  "payload": {
    "definition": {
      "skill": {
        "objective": "Explain what an immutable borrow permits in Rust",
        "criteria": {
          "read-access": "say what access an immutable borrow grants and whether ownership moves"
        }
      },
      "source_notes": [
        "Cards/Rust Borrowing.md"
      ]
    }
  }
}
